{
  "$schema": "https://json-schema.org/draft-07/schema#",
  "type": "object",
  "additionalProperties": false,
  "required": ["prometheusImage", "grafanaImage", "collectorImage", "tempoImage"],
  "properties": {
    "prometheusImage": {"$ref": "#/definitions/image"},
    "grafanaImage": {"$ref": "#/definitions/image"},
    "collectorImage": {"$ref": "#/definitions/image"},
    "tempoImage": {"$ref": "#/definitions/image"}
  },
  "definitions": {
    "image": {
      "type": "object", "additionalProperties": false,
      "required": ["repository", "digest"],
      "properties": {
        "repository": {"type": "string", "minLength": 1},
        "digest": {"type": "string", "pattern": "^sha256:[0-9a-f]{64}$"}
      }
    }
  }
}
